{
  "incident_id": "INC-0003",
  "status": "resolved",
  "summary": "The checkout and payment services experienced a 100% error rate because payment requests failed with invalid tokens for gold loyalty level users. The incident was resolved by toggling a feature flag to turn paymentFailure off, and recovery was verified after all triggering signals cleared for two consecutive checks.",
  "timeline": [
    {
      "timestamp": "2026-10-23T09:38:10Z",
      "event": "A1 Error rate: checkout error_ratio=1.000 over 2m (threshold 0.050, baseline 0.000)",
      "details": "sentinel"
    },
    {
      "timestamp": "2026-10-23T09:38:10Z",
      "event": "A2 Error rate: payment error_ratio=1.000 over 2m (threshold 0.050, baseline 0.000)",
      "details": "sentinel"
    },
    {
      "timestamp": "2026-10-23T09:38:10Z",
      "event": "opened INC-0003: Error rate on checkout",
      "details": "sentinel"
    },
    {
      "timestamp": "2026-10-23T09:38:10Z",
      "event": "INC-0003: detected -> investigating",
      "details": "system"
    },
    {
      "timestamp": "2026-10-23T09:38:22Z",
      "event": "INC-0003: investigating -> diagnosing",
      "details": "system"
    },
    {
      "timestamp": "2026-10-23T09:38:24Z",
      "event": "INC-0003: diagnosing -> auditing",
      "details": "system"
    },
    {
      "timestamp": "2026-10-23T09:38:24Z",
      "event": "INC-0003: auditing -> planning",
      "details": "system"
    },
    {
      "timestamp": "2026-10-23T09:38:26Z",
      "event": "INC-0003: planning -> awaiting_approval",
      "details": "system"
    },
    {
      "timestamp": "2026-10-23T09:38:26Z",
      "event": "approval needed for INC-0003: toggle_feature_flag {'flag': 'paymentFailure', 'enabled': False}",
      "details": "approval"
    },
    {
      "timestamp": "2026-10-23T09:38:26Z",
      "event": "preet (test operator) approved the plan",
      "details": "human"
    },
    {
      "timestamp": "2026-10-23T09:38:26Z",
      "event": "INC-0003: awaiting_approval -> executing",
      "details": "system"
    },
    {
      "timestamp": "2026-10-23T09:38:27Z",
      "event": "toggle_feature_flag {'flag': 'paymentFailure', 'enabled': False}: ok - turned paymentFailure off",
      "details": "executor"
    },
    {
      "timestamp": "2026-10-23T09:38:27Z",
      "event": "INC-0003: executing -> verifying",
      "details": "system"
    },
    {
      "timestamp": "2026-10-23T09:38:57Z",
      "event": "signals clear (1/2)",
      "details": "verifier"
    },
    {
      "timestamp": "2026-10-23T09:39:12Z",
      "event": "signals clear (2/2)",
      "details": "verifier"
    },
    {
      "timestamp": "2026-10-23T09:39:12Z",
      "event": "INC-0003: verifying -> resolved",
      "details": "system"
    }
  ],
  "diagnosis": {
    "affected_component": "payment",
    "root_cause": "payment: Payment requests are failing with an invalid token error for gold loyalty level users. [application_error]",
    "confidence": 1.0,
    "alternatives_considered": []
  },
  "evidence": [
    {
      "source": "metric",
      "observation": "[E2] alert A2 error_rate: payment error_ratio=1.000 over 2m (threshold 0.050, baseline 0.000)",
      "timestamp": "2026-10-23T09:38:10Z",
      "reference": "sum by (service_name) (rate(traces_span_metrics_calls_total{span_kind=~\"SPAN_KIND_SERVER|SPAN_KIND_CONSUMER\",status_code=\"STATUS_CODE_ERROR\",service_name=\"payment\"}[2m]))",
      "supports": "payment (application_error): payment service error ratio is 1.000"
    },
    {
      "source": "metric",
      "observation": "[E5] errors by operation: oteldemo.PaymentService/Charge error_rps=0.017",
      "timestamp": "2026-10-23T09:38:13Z",
      "reference": "service_metrics(service=payment)",
      "supports": "payment (application_error): payment service charge operation fails with invalid token"
    },
    {
      "source": "trace",
      "observation": "[E7] error span: payment oteldemo.PaymentService/Charge duration_ms=3.0 message=Payment request failed. Invalid token. demo.user_context.loyalty_level=gold",
      "timestamp": "2026-10-23T09:38:16Z",
      "reference": "trace 7484da007766e44f162161bade08ad4f",
      "supports": "payment (application_error): payment service error span indicates invalid token for gold loyalty level"
    },
    {
      "source": "log",
      "observation": "[E8] 2026-10-23T09:38:10.099Z payment warn Payment request failed. Invalid token. demo.user_context.loyalty_level=gold",
      "timestamp": "2026-10-23T09:38:18Z",
      "reference": "logs of payment via opensearch",
      "supports": "payment (application_error): payment service logs show recurring payment request failures"
    },
    {
      "source": "metric",
      "observation": "[E1] alert A1 error_rate: checkout error_ratio=1.000 over 2m (threshold 0.050, baseline 0.000)",
      "timestamp": "2026-10-23T09:38:10Z",
      "reference": "sum by (service_name) (rate(traces_span_metrics_calls_total{span_kind=~\"SPAN_KIND_SERVER|SPAN_KIND_CONSUMER\",status_code=\"STATUS_CODE_ERROR\",service_name=\"checkout\"}[2m]))",
      "supports": "the alert that opened this incident"
    },
    {
      "source": "metric",
      "observation": "[E2] alert A2 error_rate: payment error_ratio=1.000 over 2m (threshold 0.050, baseline 0.000)",
      "timestamp": "2026-10-23T09:38:10Z",
      "reference": "sum by (service_name) (rate(traces_span_metrics_calls_total{span_kind=~\"SPAN_KIND_SERVER|SPAN_KIND_CONSUMER\",status_code=\"STATUS_CODE_ERROR\",service_name=\"payment\"}[2m]))",
      "supports": "the alert that opened this incident"
    }
  ],
  "proposed_action": {
    "action": "toggle_feature_flag",
    "parameters": {
      "flag": "paymentFailure",
      "enabled": false
    },
    "reason": "Disabling the paymentFailure feature flag removes the faulty code path causing invalid payment tokens for gold loyalty users.",
    "dry_run": false
  },
  "approval": {
    "required": true,
    "decision": "approved",
    "approver": "preet (test operator)",
    "timestamp": "2026-10-23T09:38:26Z"
  },
  "execution": {
    "attempted": true,
    "action_api_only": true,
    "action_result": "toggle_feature_flag: ok - turned paymentFailure off",
    "rollback_performed": false,
    "notes": ""
  },
  "verification": {
    "checked": true,
    "recovered": true,
    "signals_checked": [
      "Error rate on checkout",
      "Error rate on payment"
    ],
    "notes": "all 2 triggering signals clear for 2 consecutive checks"
  },
  "prevention": [
    "Release payment behind a canary that is rolled back automatically on error-rate regression",
    "Add a contract test for the failing operation of payment"
  ],
  "limitations": []
}